{
  "$schema": "https://heera.github.io/wp-discovery-protocol/schema/discovery/1.0.json",
  "spec_version": "1.0",
  "site": { "name": "Example Site", "url": "https://example.com/", "description": "A WordPress site.", "lang": "en-US", "logo": "" },
  "identity": { "type": "person", "name": "Jane Dev", "role": "Software Developer", "about": "", "url": "https://example.com/", "same_as": [], "contacts": [ { "type": "email", "value": "mailto:jane@example.com" } ] },
  "documents": { "sitemap": "https://example.com/wp-sitemap.xml", "robots": "https://example.com/robots.txt", "llms": "https://example.com/llms.txt", "llms_full": "https://example.com/llms-full.txt" },
  "well_known": [
    { "name": "discovery.json", "url": "https://example.com/.well-known/discovery.json", "source": "generated" },
    { "name": "agent-card.json", "url": "https://example.com/.well-known/agent-card.json", "source": "generated" },
    { "name": "agent.json", "url": "https://example.com/.well-known/agent.json", "source": "generated" }
  ],
  "apis": [
    { "id": "woocommerce", "type": "rest", "base": "https://example.com/wp-json/wc/store/v1", "schema": "", "auth": { "type": "none", "docs": "https://woocommerce.github.io/woocommerce-rest-api-docs/" } },
    { "id": "woocommerce", "type": "rest", "base": "https://example.com/wp-json/wc/v3", "schema": "", "auth": { "type": "apikey", "docs": "https://woocommerce.github.io/woocommerce-rest-api-docs/" } }
  ],
  "agents": [
    { "name": "Store Agent", "description": "Browse the catalogue and build a cart via the WooCommerce Store API.", "skills": [ { "id": "search_products", "description": "Search and list products." }, { "id": "get_product", "description": "Fetch a single product by id or slug." }, { "id": "add_to_cart", "description": "Add an item to the cart." } ], "endpoint": "https://example.com/wp-json/wc/store/v1", "auth": "none", "id": "woocommerce", "card": "https://example.com/.well-known/agent-card.json#woocommerce" }
  ],
  "resources": [
    { "id": "woocommerce", "title": "WooCommerce", "type": "commerce", "description": "Products, categories, cart and checkout, plus an authenticated store-management API.", "version": "9.4.1", "capabilities": [ "commerce.products.read", "commerce.categories.read", "commerce.cart.write", "commerce.checkout.write", "commerce.orders.read", "commerce.orders.write", "commerce.customers.read", "commerce.coupons.read" ], "endpoints": [ { "url": "https://example.com/wp-json/wc/store/v1", "type": "rest", "methods": ["GET","POST"], "auth": "none", "description": "Public Store API: browse products and operate the cart/checkout." }, { "url": "https://example.com/wp-json/wc/v3", "type": "rest", "methods": ["GET","POST","PUT","DELETE"], "auth": "apikey", "description": "Authenticated store-management API (requires REST API keys)." } ], "schemas": [], "auth": { "type": "apikey", "oidc": "", "scopes": [], "docs": "https://woocommerce.github.io/woocommerce-rest-api-docs/" }, "well_known": [], "agent": { "name": "Store Agent", "description": "Browse the catalogue and build a cart via the WooCommerce Store API.", "skills": [ { "id": "search_products", "description": "Search and list products." }, { "id": "get_product", "description": "Fetch a single product by id or slug." }, { "id": "add_to_cart", "description": "Add an item to the cart." } ], "endpoint": "/wp-json/wc/store/v1", "auth": "none" }, "docs": "https://woocommerce.github.io/woocommerce-rest-api-docs/", "provider": { "plugin": "woocommerce/woocommerce.php" } }
  ],
  "capabilities": [ "commerce.products.read", "commerce.categories.read", "commerce.cart.write", "commerce.checkout.write", "commerce.orders.read", "commerce.orders.write", "commerce.customers.read", "commerce.coupons.read" ],
  "trust": { "security_txt": "https://example.com/.well-known/security.txt", "policy": "https://example.com/privacy-policy/" }
}
